sentence1Text,sentence2Text,mergedText
U.S. officials said Thursday Washington was certain that Syrian military intelligence operatives remain in Lebanon in defiance of international demands to withdraw all forces and agents.,U.S. officials have made no secret of their concern that Syrian intelligence officers may still be in Lebanon.,U.S. officials said Thursday Washington was certain that Syrian military intelligence operatives remain in Lebanon in defiance of international demands to withdraw all forces and agents.
"After leaving Alderson at 12:30 a.m. on March 3, 2005, Martha Steward declared the 5-month experience as ""life altering and life affirming.""",US lifestyle guru Martha Stewart is expected to leave jail on Friday after a five-month sentence for a stock scandal that reinvigorated her career rather than dooming it.,"After leaving Alderson jail at 12:30 a.m. on March 3, 2005, US lifestyle guru Martha Stewart declared the experience as ""life altering and life affirming"" after her 5-month sentence for a stock scandal that reinvigorated her career rather than dooming it."
"W. Mark Felt, the former FBI second-in-command who revealed himself as ``Deep Throat'' 30 years after he tipped off reporters to the Watergate scandal that toppled a president, has died.","W. Mark Felt, who remained anonymous for more than three decades as the source known as ``Deep Throat'' in the 1972 Watergate scandal that toppled Richard Nixon's presidency, has died.","W. Mark Felt, the former FBI second-in-command who remained anonymous for more than three decades after he tipped off reporters as the source known as ""Deep Throat'' in the 1972 Watergate scandal that toppled Richard Nixon's presidency, has died."
"Meanwhile, Lonnie Belt, said to be 40 or 41, has been charged with murder, kidnapping, assault, and evidence tampering after police say he painted walls to hide Durham's blood.","He's charged with murder, assault, kidnapping-adult, kidnapping-minor and tampering with physical evidence.","Meanwhile, Lonnie Belt, said to be 40 or 41, has been charged with murder, kidnapping-adult, kidnapping-minor, assault, and physical evidence tampering after police say he painted walls to hide Durham's blood."
"Schavan has always denied the allegations and, according to the BBC, intends to appeal.",The minister has denied the claims and said she will appeal.,"The minister Schavan has always denied the allegations and, according to the BBC, said she will appeal."
"The liftoff in southeastern India was the first launch of a rocket with two satellites aboard and notched up another achievement in New Delhi's ambitious space programme, which hopes to send a probe to the moon by 2007 or 2008.",This will be the first time two satellites will be launched in a single mission from India.,"The liftoff in southeastern India was the first launch mission of a rocket with two satellites aboard and notched up another achievement in New Delhi's ambitious space programme, which hopes to send a probe to the moon by 2007 or 2008."
"The scientists found that out of 3 million ""pull requests (when a developer writes code for someone else's project), developers more readily accepted code written by women (78.6%) than that written by men (74.6%), per the Guardian.","When a group of computer science students decided to study the way that gender bias plays out in software development communities, they assumed that coders would be prejudiced against code written by women.","When a group of computer science students decided to study the way that gender bias plays out in software development communities, they assumed that coders would be prejudiced against code written by women, but scientists instead found that out of 3 million ""pull requests (when a developer writes code for someone else's project), developers more readily accepted code written by women (78.6%) than by men (74.6%), per the Guardian."
Indonesia has scheduled a summit of world leaders for January 6.,Indonesia plans to host 23 nations in a summit to discuss the aftermath of the disaster.,Indonesia plans to host 23 nations in a summit of world leaders for January 6 to discuss the aftermath of the disaster.
Sixty-year-old Sharron Diane Crawford Smith is now accused of murdering two women at a Staunton ice cream store in 1967.,"A 60-year-old woman charged with killing two young women in a Staunton ice cream shop 41 years ago was released without bail, authorities said Friday, because she is dying from kidney and heart disease and living in a hospice facility.","Sharron Diane Crawford Smith, a 60-year-old woman now accused of murdering two young women in a Staunton ice cream shop in 1967, was released without bail, authorities said Friday, because she is dying from kidney and heart disease and living in a hospice facility."
"Counsel assisting the inquest, Jeremy Gormly SC, said as police moved in to end the 16-hour siege Ms Dawson was struck by six fragments of a police bullet or bullets, which ricocheted from hard surfaces into her body.","One fragment struck a major blood vessel and she quickly lost consciousness, he said.","Counsel assisting the inquest, Jeremy Gormly SC, said as police moved in to end the 16-hour siege, Ms. Dawson was struck by six fragments of a police bullet or bullets, which ricocheted from hard surfaces into her body where one struck a major blood vessel and she quickly lost consciousness."
The lawsuit was dismissed on June 6 for lack of evidence and Rossi did not appeal to the Supreme Court.,"Rossi ended his efforts to remove Gregoire, who was certified as governor-elect in June 2005.","The lawsuit was dismissed on June 6 for lack of evidence and Rossi did not appeal to the Supreme Court, ending his efforts to remove Gregoire, who was certified as governor-elect in June 2005."
"According to this L.A. Times story (which credits the team-owned flagship radio station), the Angels have made an eight-year offer to free agent first baseman Mark Teixeira.",The Los Angeles Angels made an eight-year offer to first baseman Mark Teixeira during winter meetings in Las Vegas.,"According to this L.A. Times story (which credits the team-owned flagship radio station), the Angels have made an eight-year offer to free agent first baseman Mark Teixeira during winter meetings in Las Vegas."
"Video of Brooklyn Mother of 13 Zurana Horton shot and killed in a gang shooting was revealed Thursday, according to the N.Y. Daily News.",A shocking video released for the first time Thursday captures the moment a Brooklyn mother of 12 was killed in a gang shootout as she picked her daughter up from school.,"A shocking video released for the first time Thursday, according to the N.Y. Daily News, captures the moment Zurana Horton, a Brooklyn mother of 12, was killed in a gang shootout as she picked her daughter up from school."
"On Sept. 15, 1998 District Attorney Hunter took the case before a grand jury.",Boulder District Attorney Alex Hunter brought the case before the grand jury.,"Boulder District Attorney Alex Hunter brought the case before the grand jury on Sept. 15, 1998."
"By April 2005 the cause of legalizing gay marriage was making remarkable headway in Europe and Canada, edging slowly ahead in sections of the U.S. and facing aggressive opposition in some other states.",Saskatchewan became the seventh Canadian province to allow gay marriage.,"By April 2005 the cause of legalizing gay marriage was making remarkable headway in Europe and Canada, where Saskatchewan became the seventh province to allow it, edging slowly ahead in sections of the U.S. and facing aggressive opposition in some other states."
"Bogoyavlensky and other experts believe gas emissions, possibly linked to climate change, are causing the holes to appear and suspect there are many more to be found, reports NBC News.","Now, with the help of satellite imagery, researchers have located four additional craters--and they believe there may be dozens more in the region.","Bogoyavlensky and other experts believe gas emissions, possibly linked to climate change, are causing four additional craters to appear, which researchers have located with the help of satellite imagery and suspect there are dozens more to be found in the region, reports NBC News."
The former FBI second-in-command who revealed himself as ``Deep Throat'' 30 years after he tipped off reporters to the Watergate scandal that toppled a president has died.,"W. Mark Felt, who remained anonymous for more than three decades as the source known as ``Deep Throat'' in the 1972 Watergate scandal that toppled Richard Nixon's presidency, has died.","W. Mark Felt, the former FBI second-in-command who remained anonymous for more than three decades after he tipped off reporters as the source known as ""Deep Throat'' in the 1972 Watergate scandal that toppled Richard Nixon's presidency, has died."
"Fred LaRue, a close aide to former Attorney General John Mitchell and the first person to plead guilty in the Watergate scandal, died of natural causes.",Deep Throat suspect found dead in hotel,"Fred LaRue, known as Deep Throat suspect, close aide to former Attorney General John Mitchell, and the first person to plead guilty in the Watergate scandal, was found dead of natural causes in hotel."
"L. Patrick Gray III, Acting Director of the FBI during the Watergate crisis expressed anger, shock, and betrayal at Felt's revelation.","L. Patrick Gray III, the acting director of the FBI at the time of the Watergate break-in, ended more than three decades of silence about his role in the scandal, saying in a television interview broadcast Sunday that he felt shock and betrayal by the disclosure that his former deputy, W. Mark Felt, was Deep Throat.","L. Patrick Gray III, the acting director of the FBI at the time of the Watergate break-in, ended more than three decades of silence about his role in the scandal, saying in a television interview broadcast Sunday that he felt anger, shock and betrayal by the disclosure that his former deputy, W. Mark Felt, was Deep Throat."
Curtis Collman III reportedly said there was no food and went back to sleep.,"Collman told his 8-year-old son that there was no food in their house in Crothersville, Indiana, and went back to sleep.","Curtis Collman III reportedly told his 8-year-old son that there was no food in their house in Crothersville, Indiana, and went back to sleep."
The Russian navy was considering buying one or two submersible rescue vessels.,"Defense Minister Sergei Ivanov decided to buy two remote-controlled, deep-diving Scorpio underwater vehicles for the Russian navy, Pacific Fleet Commander Admiral Viktor Fyodorov told the Itar-Tass news agency Tuesday.","Defense Minister Sergei Ivanov decided to buy two remote-controlled, deep-diving Scorpio underwater rescue vessels for the Russian navy, Pacific Fleet Commander Admiral Viktor Fyodorov told the Itar-Tass news agency Tuesday."
The council voted unanimously Monday to impose a 2.25 percent tax on the city's highest earners.,"The measure applies a 2.25 percent tax on total income above $250,000 for individuals and above $500,000 for married couples filing their taxes together.","The council voted unanimously Monday on a measure which applies a 2.25 percent tax on the city's highest earners, with total income above $250,000 for individuals and above $500,000 for married couples filing their taxes together."
Staunton Police Chief Jim Williams announced 61-year-old Sharron Diane Crawford Smith was arrested around 10:24 a.m. Friday and charged with two counts of first degree murder.,"This morning, 41 years later, Staunton police have arrested and charged Sharron Diane Crawford Smith, age 61, with two counts of first-degree murder.","41 years later, Staunton Police Chief Jim Williams announced 61-year-old Sharron Diane Crawford Smith was arrested around 10:24 a.m. Friday and charged with two counts of first degree murder."
"On November 3, a second tremor lasted 25 minutes.  ","Next day, a tremor lasting twenty-five minutes prompted scientists to warn of a more serious eruption but the nearest residents thirty miles from the crater were not evacuated.  ","Next day, on November 3, a second tremor lasting twenty-five minutes prompted scientists to warn of a more serious eruption but the nearest residents thirty miles from the crater were not evacuated."
In August 2005 the government ordered all officials with coalmine investments to withdraw their stakes.,"836 officials and state-owned enterprise (SOE) leaders have abandoned their coal mine investments in north China's Shanxi province, a major coal producing region, amid a nationwide crackdown on illegal coal mine investment by officials.","836 officials and state-owned enterprise (SOE) leaders have abandoned their coal mine investments in north China's Shanxi province, a major coal producing region, amid a nationwide crackdown on illegal coal mine investment by government officials in August 2005."
The beautiful party girl Tara Reid is taking the time this season and checking herself into rehab.,"Although the rep wouldn't reveal why she entered rehab, a source from the magazine said that it was her decision to get help.","Although the rep wouldn't reveal why the beautiful party girl Tara Reid entered rehab this season, a source from the magazine said that it was her decision to get help."
"After the hearing, the city capped her sewer, a move she calls ""pure evil.""","And today, the city capped off her sewer for unpaid bills.","After the hearing, the city today capped off her sewer for unpaid bills, a move she calls ""pure evil."""
"In December, after the bodies of the couple were discovered, investigators thought Sherman had murdered his wife, and then killed himself, as stated by a police source.","The source stated private investigators believe Barry, 75, and Honey, 70, were killed two days before the bodies were discovered.","In December, after the bodies of the couple, Barry, 75, and Honey, 70, were discovered, private investigators thought Sherman had murdered his wife, and then killed himself, two days before, as stated by a police source."
He has pleaded innocent to all charges.,"Kaczynski intends to plead innocent at trial, and prosecutors are unsure if they will seek the death penalty.","Kaczynski intends to plead innocent to all charges at trial, and prosecutors are unsure if they will seek the death penalty."
"But his YouTube career came skidding to a halt with a video titled ""Throwing Water On Peoples Faces PT.","Mosallah, speaking to BBC Trending in his first interview since his original YouTube channel was taken offline, says the video was not meant to resemble an actual acid attack.","Mosallah, speaking to BBC Trending in his first interview since his original YouTube channel was taken offline, says the video, titled ""Throwing Water on Peoples Faces PT"", was not meant to resemble an actual acid attack."
The poster hung undisturbed for 51 days.,"After the poster stayed up unnoticed for more than a month, Maravilla tweeted about the prank and it quickly went viral.","After the poster stayed up unnoticed for 51 days, Maravilla tweeted about the prank and it quickly went viral."
The 63-33 vote all but guarantees the legislation will pass the Senate and reach President Barack Obama by year's end.,"The bill now heads to President Barack Obama, who plans to sign it into law, overturning what repeal advocates believed was a discriminatory policy that has unfairly ended the careers of thousands of gay members of the military.","The 63-33 vote all but guarantees the legislation will pass the Senate and reach President Barack Obama by year's end, who plans to sign it into law, overturning what repeal advocates believed was a discriminatory policy that has unfairly ended the careers of thousands of gay members of the military."
Wladimir Klitschko defended his IBF heavyweight crown by stopping Hasim Rahman in the seventh round at SAP Arena on Saturday.,Wladimir Klitschko defended his IBF heavyweight crown with ease after stopping American Hasim Rahman after 44 seconds of the seventh round of their contest at the SAP Arena in Germany.,Wladimir Klitschko defended his IBF heavyweight crown with ease after stopping American Hasim Rahman after 44 seconds of the seventh round of their contest at the SAP Arena in Germany on Saturday.
"Near Krakow, Poland, 800,000 people gathered for a mass in memory of the Polish-born pope.","The huge gathering had set off some two hours earlier from central Market Square in Krakow for a silent, white march in homage to John Paul II.","The huge gathering of 800,000 people had set off some two hours earlier from central Market Square in Krakow, Poland for a silent, white march in homage to the Polish-born pope, John Paul II."
"Asberry, 64, and her grandchildren, ages 6 to 9, died early Saturday after being swept away by floodwaters in Palestine, police said.","Police said it appeared Asberry and the children attempted to escape the home, but water swept them away.","Asberry, 64, and her grandchildren, ages 6 to 9, died early Saturday after being swept away by floodwaters in Palestine while attempting to escape the home, police said."
Pete and Ariana just went and got tattoos together (along with some of Ariana's friends).,"They may have only been together for a few months, by Pete Davidson and Ariana Grande have wasted no time in making their love permanent with lots and lots of tattoos.","They may have only been together for a few months, but Pete Davidson and Ariana Grande (along with some Ariana's friends) have wasted no time in making their love permanent with lots and lots of tattoos."
"""I thought, 'Oh gee, I don't have the experience, I don't know enough.'","And now I am thinking, 'Oh.'""","I thought, 'Oh gee, I don't have the experience, I don't know enough.'"
"The U.S. Marshals have added to their ”15 Most Wanted“ list of fugitives a man serving three life sentences who escaped custody during his transport from Huntsville, Texas, to Stiles, Texas.","A Texas inmate escaped from a prison van near Houston after pulling a gun on two guards who were transporting him between prisons, according to a Texas prison statement Monday.","The U.S. Marshals have added to their ”15 Most Wanted“ list of fugitives a man serving three life sentences who escaped custody during his transport from Huntsville, Texas, to Stiles, Texas, after pulling a gun on two guards, according to a Texas prison statement Monday."
The February assassination of former Lebanon Prime Minister Hariri put Syria under renewed pressure from the international community to abide by U.N. Security Council Resolution 1559 and withdraw its troops from Lebanon.,"Foreign ministers from all European Union (EU) member states, who gathered here for a meeting, on Wednesday urged Syria to withdraw its troops completely from Lebanon.","The February assassination of former Lebanon Prime Minister Hariri put Syria under renewed pressure from foreign ministers from all European Union (EU) member states gathered for a meeting, on Wednesday to abide by U.N. Security Council Resolution 1559 and withdraw its troops from Lebanon."
"Under a Pentagon directive, bans on cell phone use while driving are becoming common on military bases.",A National Highway Traffic Safety Administration survey prompted the Department of Defense to restrict driver cell-phone use on military facilities.,"A National Highway Traffic Safety Administration survey prompted the Department of Defense to implement bans, which are becoming common, on driver cell-phone use on military facilities."
"As the Patriots became a dynasty and Belichick became the first coach to win three Super Bowls in four years, an entire system of covert videotaping was developed and a secret library created.","Inside a room accessible only to Belichick and a few others, they found a library of scouting material containing videotapes of opponents' signals, with detailed notes matching signals to plays for many teams going back seven seasons.","As the Patriots became a dynasty and Belichick became the first coach to win three Super Bowls in four years, they found that an entire system of covert videotaping of opponents' signals was developed and a secret library created with scouting material and detailed notes matching signals to plays for many teams going back seven seasons."
"Three or four robbers burst into the store on ritzy Avenue Montaigne near the Champs-Elysees late Thursday afternoon and stole watches, rings and necklaces.","Armed robbers-some disguised as women-snatched $108 million worth of diamond rings, necklaces and luxury watches from a Harry Winston boutique on a posh Paris avenue in one of the largest jewel heists in history, officials said Friday.","Three or four armed robbers - some disguised as women - snatched $108 million worth of diamond rings, necklaces and luxury watches from a Harry Winston boutique on posh, ritzy, Paris Avenue Montaigne near the Champs-Elysees late Thursday afternoon in one of the largest jewel heists in history, officials said Friday."
"His family told News 4 New York that he has severe burns and fractured ribs, and that he's going into surgery on Thursday.","In a new video of a fiery crash that critically injured a West New York man Sunday night, police officers are seen kicking and dragging the man -- who sources say was a victim in the two-car wreck -- into the roadway.","In a new video of a fiery crash that critically injured a West New York man Sunday night, police officers are seen kicking and dragging the man, who sources say was a victim in the two-car wreck, and whose family told News 4 New York that he has severe burns and fractured ribs, and that he's going into surgery on Thursday -- into the roadway."
"A man whose decapitated head was pinned to the gates of a French factory in a grisly attack has been identified as a local businessman from eastern France, a source close to the investigation said Friday.","According to reports the victim in the attack, a man who was decapitated, was not an employee at the factory.","A man whose decapitated head was pinned to the gates of a French factory in a grisly attack was not an employee at the factory and has been identified as a local businessman from eastern France, a source close to the investigation said Friday."
"In a federal complaint, Foster says she was told by acting HUD director Craig Clemmensen to ""find money"" for the redecoration.","Mr. Clemmensen, acting on Mrs. Carson's behalf, told Mrs. Foster to ""find money"" to purchase better furniture for the office - and he quipped that ""$5,000 will not even buy a decent chair,"" according to the complaint, which was reported by The Guardian newspaper.","Mr. Clemmensen, acting on Mrs. Carson's behalf, told Mrs. Foster to ""find money"" to purchase better furniture for the office - and he quipped that ""$5,000 will not even buy a decent chair,"" according to the complaint, which was reported by The Guardian newspaper."
"On Wednesday, tour director Jean-Marie Leblanc sounded convinced that Armstrong had been caught.","But Jean-Marie Leblanc, the director of the Tour de France, called the newspaper's report ""very complete, very professional, very meticulous.""","But on Wednesday Jean-Marie Leblanc, the director of the Tour de France, sounded convinced that Armstrong had been caught and called the newspaper's report ""very complete, very professional, very meticulous."""
"Then, Obama delivered a rousing keynote address at the Democratic National Convention and, in 20 minutes, his rising star was ascendant.","Obama, whose father was from Kenya and mother was from Kansas, rose to national prominence after delivering a keynote address at the Democratic National Convention this July.","Obama, whose father was from Kenya and mother was from Kansas, rose to national prominence, and in 20 minutes, his rising star was ascendant after delivering a rousing keynote address at the Democratic National Convention this July,"
The US House of Representatives on Wednesday approved a 6.1-billion-dollar package of tax breaks to help families recover from Hurricane Katrina which hit the Gulf Coast areas late last month.,The package offers tax assistance to people and businesses dislocated by Hurricane Katrina and expanded tax breaks for some charitable donations to help them.,The US House of Representatives on Wednesday approved a 6.1-billion-dollar package of tax breaks to help dislocated people and businesses and some charitable donations for them and families to recover from Hurricane Katrina which hit the Gulf Coast areas late last month.
The government and FARC continued to argue over details of a prisoner swap.,Uribe announced in October that he was read to negotiate a prisoner exchange with the largest of the country's rebel groups.,"The government and FARC, the largest of the country's rebel groups, continued to argue over details of a prisoner swap, after Uribe announced in October that he was ready to negotiate with FRAC."
"A fire that ripped through a Waitrose store in Surrey is being treated as ``potentially suspicious'', police said.",A Waitrose store was reduced to ruins after a blaze being treated by police as ``potentially suspicious''.,"A Waitrose store in Surrey was reduced to ruins after a blaze being treated by police as ``potentially suspicious."""
"Tara Reid has checked into Promises Treatment Center, a prominent rehab clinic in Los Angeles.",The beautiful party girl Tara Reid is taking the time this season and checking herself into rehab.,"The beautiful party girl Tara Reid is taking the time this season and checking herself into rehab at Promises Treatment Center, a prominent clinic in Los Angeles."
