sentence1Text,sentence2Text,mergedText
"Palestine's bid for statehood took one step forward yesterday as it gained initial approval for full membership in the United Nations Educational, Scientific, and Cultural Organization.","Palestine has won a first diplomatic victory in its quest for statehood as UNESCO's executive committee backed its bid to become a member, a move deemed ""inexplicable"" by the United States.","Palestine has won a first diplomatic victory in its quest for statehood yesterday as UNESCO's executive committee backed its bid to become a full member, a move deemed ""inexplicable"" by the United States."
A federal appeals court agreed to consider a new hearing but Terri died first.,A U.S. federal appeals court early Wednesday agreed to consider a petition by Terri Schiavo's parents for a new hearing on whether to reconnect their severely brain-damaged daughter's feeding tube.,"A U.S. federal appeals court early Wednesday agreed to consider a petition by Terri Schiavo's parents for a new hearing on whether to reconnect their severely brain-damaged daughter's feeding tube, but Terri died first."
"An explosion at a petrochemical plant on the Songhua River in northeast China on Nov. 13, 2005 threatened toxic benzene pollution of drinking water of Harbin, urban population 3.8 million.",Explosions at a petrochemical plant on 13 November caused major water pollution by benzene and nitrobenzene on northeastern China's Songhua River.,"An explosion at a petrochemical plant on the Songhua River in northeast China on Nov. 13, 2005 threatened toxic benzene and nitrobenzene pollution of drinking water of Harbin, urban population 3.8 million."
Seacom announced that it has fully restored all its customers on alternative routes,"Subsea cable operator, Seacom, announced on Twitter today (20 October 2011) that they have restored services to all customers using alternate routes, following an outage that was initially expected to take 12 days to repair.","Subsea cable operator, Seacom, announced on Twitter today (20 October 2011) that they have restored services to all customers using alternate routes, following an outage that was initially expected to take 12 days to repair."
"Daron Dylon Wint, 34, is wanted for first-degree murder while armed, police said late Wednesday.","Police said they had obtained a warrant for the arrest of Daron Dylon Wint, who they said is 34 and is from Maryland.","Police said they had obtained a warrant for the arrest of Daron Dylon Wint, who they said is 34 and is from Maryland, for first-degree murder while armed."
"Last week the 90-year-old royal matriarch skipped Christmas church services due to her illness, and Buckingham Palace announced Sunday she'd also be staying home from a New Year's Day service at her estate in Sandringham, the New York Times reports.","Queen Elizabeth did not attend a New Year's Day church service as she continues to recover from a ""heavy cold,"" a Buckingham Palace spokesman said.","The 90-year-old Queen Elizabeth stayed at home from a New Year's Day church service at her estate in Sandringham as she continues to recover from a ""heavy cold,"" which also kept her away from Christmas church services the week before, a Buckingham Palace spokesman said, following on the palace's announcement the week before, reported by the New York Times."
Singh's lawyer and family accuse authorities of killing him and are calling for a top-level probe.,Singh's lawyer and his family alleged foul play in his death and said he had been assaulted in jail prior to his death.,"Singh's lawyer and his family alleged foul play in his death, said he had been assaulted in jail prior to his death, and are calling for a top-level probe."
Pierre Thomas is headed to injured reserve,Coach Sean Payton announced Wednesday that Pierre Thomas was placed on IR.,Coach Sean Payton announced Wednesday that Pierre Thomas was placed on injured reserve.
On April 16 2007 a gunman killed 32 people and wounded 29 others at Virginia Tech before killing himself.,The gunman then killed himself.,On April 16 2007 a gunman killed 32 people and wounded 29 others at Virginia Tech before killing himself.
"Martha Stewart reported to the Alderson Federal Prison Camp, known as Camp Cupcake, in West Virginia on October 8 to begin serving a five-month sentence.","Home fashion guru Martha Stewart said on Friday that she has adjusted to prison life and is keeping busy behind bars since reporting a week ago to a federal penal camp in West Virginia, where she is serving a five-month sentence for lying about a stock sale.","Home fashion guru Martha Stewart said on Friday that she has adjusted to prison life and is keeping busy behind bars since reporting on October 8 to a Alderson Federal Prison Camp, known as Camp Cupcake, in West Virginia, where she is serving a five-month sentence for lying about a stock sale."
"On Oct. 27, 2005, a little more than three weeks after offering the nomination of Harriet Miers, President Bush announced that she had withdrawn her nomination.",Harriet Miers withdrew her nomination from consideration as a Supreme Court justice.,"On Oct. 27, 2005, a little more than three weeks after offering the nomination of Harriet Miers, President Bush announced that she had withdrawn her nomination as a Supreme Court justice."
Part of the economic impact of Katrina is the unemployment rate in Louisiana which has risen to 11.5%.,"Job losses after Hurricane Katrina sent Louisiana's unemployment rate soaring to 11.5 percent, the highest level since the 1980s oil crash, officials said Tuesday.","Part of the economic impact of Hurricane Katrina is Louisiana's unemployment rate soaring to 11.5 percent, the highest level since the 1980s oil crash, officials said Tuesday."
Turkmenistan's voters are going to the polls in parliamentary elections portrayed by the government as a step towards democracy in the gas-rich Central Asian nation.,"The government of Turkmenistan said 90 per cent of eligible voters had participated in parliamentary elections Sunday, despite boycotts from opposition groups.","The government of Turkmenistan said 90 percent of eligible voters had participated in parliamentary elections Sunday, portrayed by the government as a step towards democracy in the gas-rich Central Asian nation, despite boycotts from opposition groups."
"The New Orleans Saints placed Reggie Bush on injured reserve today, officially ending his third NFL season.","The New Orleans Saints placed running back Reggie Bush on Injured Reserve Wednesday, ending the former first-round picks season two games short of the year's finale with a sprained medial collateral ligament in his left knee.","The New Orleans Saints placed running back Reggie Bush on Injured Reserve Wednesday, ending the former first-round picks third NFL season and season two games short of the year's finale with a sprained medial collateral ligament in his left knee."
Jury shown horrific moment innocent mother is shot dead shielding her child when she's caught up in gang attack as she picks up daughter from school,A shocking video released for the first time Thursday captures the moment a Brooklyn mother of 12 was killed in a gang shootout as she picked her daughter up from school.,"A shocking video was released for the first time Thursday, and the Jury was shown, the horrific moment innocent Brooklyn mother of 12 is shot dead shielding her child when she's caught up in gang attack as she picks up daughter from school"
"Across the border, Khabarovsk, Russia, is planning a quick upgrade of their water purification facilities.",Russia ordered Khabarovsk's water purification facilities upgraded.,"Across the border, Khabarovsk, Russia, is planning a quick upgrade of their water purification facilities."
"Plath penned several poems about her miscarriage, including the line, ""Already your doll grip lets go.""","Several of Plath's poems address her miscarriage, such as Parliament Hill Fields: ""Already your doll grip lets go.""","Several of Plath's poems address her miscarriage, such as Parliament Hill Fields: ""Already your doll grip lets go."""
"Lancaster County Sheriff's Office detective Jason Catoe described Soren's injuries as ""one of the most brutal things I have ever seen.""","Sixth Circuit Solicitor Randy Newman called Soren's death a ""month-long killing,"" according to WSOC-TV.","Lancaster County Sheriff's Office detective Jason Catoe described Soren's injuries as ""one of the most brutal things I have ever seen,"" and Sixth Circuit Solicitor Randy Newman described them as a ""month-long killing,"" according to WSOC-TV."
The U.S. Environmental Protection Agency determined in 2015 that Volkswagen manipulated software so that diesel emissions controls worked only when cars were on test stands.,Volkswagen has admitted to programming its diesel engines to activate pollution controls when being tested in government labs and turning them off when on the road.,"The U.S. Environmental Protection Agency determined in 2015 what Volkswagen has admitted to, that they manipulated software so that diesel emissions controls worked only when cars were on test stands in government labs."
"Four men rammed their car into an up-market jewellery store in central Paris today, smashing the shop window and making off with a €2 million (R26 million) booty, a police source said.","Four men rammed their car into an upmarket jewelry store in central Paris on Monday, smashing the shop window and stealing $2.6 million (two million Euros) in jewelry, according to AFP.","Four men rammed their car into an upmarket jewelry store in central Paris on Monday, smashing the shop window and stealing $2.6 million (two million Euros) in jewelry, according to AFP."
"George J. Felos, the lawyer for Terri's husband, said Michael Schiavo was saddened by the protracted legal maneuvering but ""very grateful"" for Thursday's court action.","The state immediately appealed to the Florida Supreme Court, which refused to overrule Greer.","George J. Felos, the lawyer for Terri's husband, said Michael Schiavo was saddened by the protracted legal maneuvering but ""very grateful"" for Thursday's court action in which the state appealed to the Florida Supreme Court, which refused to overrule Greer."
"While we are aware of the imperfect results of any approach chosen, we remain committed to our publishing model and note that the quantity of published pages in ""Vault 7"" part one (""Year Zero"") already eclipses the total number of pages published over the first three years of the Edward Snowden NSA leaks.","WikiLeaks said that the files were created between 2013 and 2016 and that it would publish only a portion of the archive - redacting some sensitive samples of code - ""until a consensus emerges on the technical and political nature of the CIA's program.""","While we are aware of the imperfect results of any approach chosen, we remain committed to our publishing model and note that the quantity of published pages in ""Vault 7"" part one (""Year Zero"") already eclipses the total number of pages published over the first three years of the Edward Snowden NSA leaks, which WikiLeaks said were created between 2013 and 2016 and that it would publish only a portion of the archive - redacting some sensitive samples of code - ""until a consensus emerges on the technical and political nature of the CIA's program."""
Numerous messages referred to drinking and using LSD and marijuana.,"There were many references to smoking, buying, and sharing ""weed"" from as early as April 2014, when the Turner was in Ohio, throughout his short time at Stanford.","There were many messages with references to drinking and using LSD and smoking, buying, and sharing ""weed"" from as early as April 2014, when the Turner was in Ohio, throughout his short time at Stanford."
"Under mounting pressure, Syria has withdrawn 4,000 of its 14,000 troops.",Pressure on Syria to withdraw its troops and intelligence agents has intensified since the slayings of former Lebanese Prime Minister Rafik Hariri and 16 others in a Feb. 14 bombing.,"Pressure on Syria to withdraw its troops, causing them to withdraw 4,000 of 14,000, and intelligence agents has intensified since the slayings of former Lebanese Prime Minister Rafik Hariri and 16 others in a Feb. 14 bombing."
"""From in or around 2014 to the present, defendants knowingly and intentionally conspired with each other (and with persons known and unknown to the grand jury) to defraud the United States by impairing, obstructing, and defeating the lawful functions of the government through fraud and deceit for the purpose of interfering with the U.S. political and electoral processes, including the presidential election of 2016,'' the indictment states.",The indictment details an elaborate plot to interfere in the 2016 U.S. presidential election.,"""From in or around 2014 to the present, defendants knowingly and intentionally conspired with each other (and with persons known and unknown to the grand jury) to defraud the United States by impairing, obstructing, and defeating the lawful functions of the government through fraud and deceit for the purpose of interfering with the U.S. political and electoral processes, including the presidential election of 2016,'' the indictment states."
"A friend told police that Klein had intended to leave her husband, who she found controlling; the source added that Ferrante believed she was having an affair.","In February, while attending a conference in San Francisco, Klein told a male friend that she planned to leave her husband, according to the complaint.","In February, while attending a conference in San Francisco, Klein told a male friend that she planned to leave her husband, who she found controlling, according to the complaint, and the source added that Ferrante believed she was having an affair."
"One day after Chris Ivory was surprisingly lost for the season, the Saints placed Thomas on injured reserve.","Pierre Thomas, the Saints' leading rusher in 2009, was put on injured reserve, the team announced Wednesday.","One day after Chris Ivory was surprisingly lost for the season, the Saints placed leading rusher Pierre Thomas on injured reserve."
"Qatar and Uganda have donated $100 million and $200,000 respectively.",Qatar was donating $100 million for the victims of the hurricane.,"Qatar and Uganda have donated $100 million and $200,000 respectively for the victims of the hurricane."
"One day after Chris Ivory was surprisingly lost for the season, the Saints placed Thomas on injured reserve.",The New Orleans Saints placed Pierre Thomas on injured reserve Wednesday because of an ankle injury.,"One day after Chris Ivory was surprisingly lost for the season, the New Orleans Saints placed Pierre Thomas on injured reserve because of an ankle injury."
"Bettie Page, the raven-haired pin-up whose naughty-but-nice romps with whips, garters and high heels titillated a generation of young men in the post-war years, has died at the age of 85 after suffering a heart attack earlier this month and slipping into a coma.","Bettie Page, the 1950s pin-up model who helped set the stage for the 1960s sexual revolution, has died.","Bettie Page, the raven-haired 1950s pin-up whose naughty-but-nice romps with whips, garters and high heels titillated a generation of young men in the post-war years and helped set the stage for the 1960s sexual revolution, has died at the age of 85 after suffering a heart attack earlier this month and slipping into a coma."
"A judge on Saturday sentenced the man who killed four people during a brazen courthouse escape to multiple life sentences with no chance of parole, and to hundreds more years on more than 50 charges.",A judge on Saturday sentenced the man who killed four people in a brazen courthouse escape to multiple life sentences with no chance of parole after a deadlocked jury failed to return a death sentence.,"A judge on Saturday sentenced the man who killed four people in a brazen courthouse escape to multiple life sentences with no chance of parole, and to hundreds more years on more than 50 charges, after a deadlocked jury failed to return a death sentence."
"Carabinieri paramilitary police in Palermo said Gaetano Lo Presti, 52, hanged himself in his cell in a Palermo jail Tuesday evening, hours after he was arrested in the raid.","A suspected Mafia leader has hanged himself in prison in Sicily hours after being arrested, Italian police say.","Carabinieri paramilitary police in Palermo said suspected Mafia leader Gaetano Lo Presti, 52, hanged himself in his cell in a Palermo, Sicily jail Tuesday evening, hours after he was arrested in the raid."
A runoff election will be held December 26.,Yushchenko lost the election but fraud findings led to another election in December.,Yushchenko lost the election but fraud findings led to a runoff election on December 26.
"Russian authorities thanked the British and praised the international rescue effort that included the United States, having appealed for help in a significant gesture to its former Cold War enemies.","Russian authorities thanked the British and praised the international rescue effort that included the United States, but criticism quickly arose over why the nation's once-formidable navy needed outside help.","Russian authorities thanked the British and praised the international rescue effort that included the United States, having appealed for help in a significant gesture to its former Cold War enemies, but criticism quickly arose over why the nation's once-formidable navy needed outside help."
"They were not victims of the crimes they claimed,"" Civil Police Chief Fernando Veloso said during a news conference.","They were not victims of the crimes they claimed,'' he said.","They were not victims of the crimes they claimed,"" Civil Police Chief Fernando Veloso said during a news conference."
"""We tend to play with things that are fanciful and strange,"" he says.","""We tend to play with things that are fanciful and strange,"" Olson said.","""We tend to play with things that are fanciful and strange,"" Olson said."
"Pierre Thomas, one of the stars of last season's Super Bowl run, was placed on injured reserve on Wednesday because of his injured ankle.",The New Orleans Saints placed Pierre Thomas on injured reserve Wednesday because of an ankle injury.,"Pierre Thomas, one of the stars of last season's Super Bowl run, was placed on injured reserve by the New Orleans Saints on Wednesday because of his injured ankle."
"The directors of Fannie met on Dec. 19 to decide Raines' fate, but the meeting concluded without any announcement of a decision.",Fannie Mae's board met Sunday night to discuss Raines' future.,"The directors of Fannie met on Dec. 19 to decide Raines' fate, but the meeting concluded without any announcement of a decision."
"The NYPD, which turned to social media to find the couple, is working to reunite them with the ring.","But just moments after they touched down at the airport, a friend alerted them to the social media campaign being driven by the New York Police Department.","But just moments after they touched down at the airport, a friend alerted them to the social media campaign being driven by the New York Police Department to reunite the couple with the ring."
"By Monday night fishermen and navy teams found 218 survivors, in lifeboats, clinging to debris, or on beaches.","By January 3, around 200 people had been rescued from the sea by naval vessels and fishermen, and an unknown number of bodies had been recovered.  ","By night of January 3, around 218 people in lifeboats, clinging to debris, or on beaches had been rescued from the sea by naval vessels and fishermen, and an unknown number of bodies had been recovered."
"Kelly Renee Gissendaner, whose execution was delayed earlier this year first by snow and then by a ""cloudy"" drug, is scheduled to die at 7pm, but the state's Board of Pardons and Paroles has decided to hold a last-minute clemency hearing, reports Reuters.",She is scheduled to be put to death by lethal injection at 7 p.m. Tuesday.,"Kelly Renee Gissendaner, whose execution was delayed earlier this year first by snow and then by a ""cloudy"" drug, is scheduled to die at 7pm Tuesday, but the state's Board of Pardons and Paroles has decided to hold a last-minute clemency hearing, reports Reuters."
Improved planning and additional power plants would seem to improve reliability and lessen the chance for a widespread blackout like the one in 2003.,"In 2003, fifty million Americans lost power in a blackout originating in Ohio.","Improved planning and additional power plants would seem to improve reliability and lessen the chance for a widespread blackout like the one originating in Ohio in 2003, where fifty million Americans lost power."
On Sept. 4 Putin fired the head of the navy.,"The head of the Russian navy was fired, probably in part because of the accident.","On Sept. 4 Putin fired the head of the Russian navy , probably in part because of the accident."
"He says the hostages are employees of The Pathway Home, a privately run program on the veterans home's grounds.",The program treats veterans of the Iraq and Afghanistan wars with post-traumatic stress disorder.,"He says the hostages are employees of The Pathway Home, a privately run program on the veterans home's grounds that treats veterans of the Iraq and Afghanistan wars with post-traumatic stress disorder."
"Yesterday, the police explained that officers shot and killed a 16-year-old Kimani Gray in Brooklyn because he allegedly pointed a gun at the cops.",Two plainclothes NYPD officers shot and killed a 16-year-old Brooklyn resident after police say he pointed a gun at officers on Saturday,"Yesterday, the police explained that two plainclothes NYPD officers shot and killed a 16-year-old Kimani Gray in Brooklyn because he allegedly pointed a gun at the cops."
"In a third round of voting on 26 December, Yushchenko won 51.99% of the vote to Yanukovich's 44.20%.",Repeat election held December 26,"In a third round of voting on 26 December, Yushchenko won 51.99% of the vote to Yanukovich's 44.20%."
"Under a Pentagon directive, bans on cell phone use while driving are becoming common on military bases.",Cell phone use while driving is being banned on military bases,"Under a Pentagon directive, bans on cell phone use while driving are becoming common on military bases."
"In mid-January, just before the upcoming elections, a Catholic archbishop was kidnapped by gunmen in Mosul.","On January 15th gunmen kidnapped the Syrian Archbishop of Mosul, an act interpreted as warning Christians not to vote in the forthcoming elections.","On January 15th gunmen kidnapped the Syrian Catholic Archbishop  of Mosul, an act interpreted as warning Christians not to vote in the forthcoming elections."
"Authorities have previously said that the foundation's former executive director, Russell C. Taylor, 43, of Indianapolis, was charged in early May with seven counts of production of child pornography and one count of possession of child pornography.","Federal prosecutors filed a criminal complaint on May 4 against Russell Taylor, 43, charging him with seven counts of production and one count of possession of child pornography.","Authorities have previously said that the foundation's former executive director, Russell C. Taylor, 43, of Indianapolis, was charged by Federal prosecutors on May 4 with seven counts of production of child pornography and one count of possession of child pornography."
"An amusement company bought the mothballed ship and towed it to Seacliff State Beach around 1930, retrofitting it with a dance floor and even a swimming pool.","She was launched on 29 May 1919, too late to see service in the war and was mothballed in Oakland until 1929, when she was bought by the Seacliff Amusement Corporation and towed to Seacliff State Beach and refitted as an amusement ship.","She was launched on 29 May 1919, too late to see service in the war and was mothballed in Oakland until 1929, when she was bought by the Seacliff Amusement Corporation and towed to Seacliff State Beach and refitted around 1930 as an amusement ship with a dance floor and even a swimming pool."
"Bettie Page, the 1950s pin-up model who helped set the stage for the 1960s sexual revolution, has died.","Famous 1950s pin up star Betty Page has died in Los Angeles, aged 85.","Bettie Page, the famous 1950s pin-up model who helped set the stage for the 1960s sexual revolution, has died in Los Angeles at age 85."
"According to People, Connelly was visiting her uncle in Montana on May 4 on the way to a new job as a bakery manager in Alaska when she decided to go on a day hike in Great Bear Wilderness with her dog Mogi.","Connelly went for a day hike on Thursday, May 4 prompting an extensive search when she didn't return.","According to People, Connelly was visiting her uncle in Montana on Thursday, May 4 on the way to a new job as a bakery manager in Alaska when she decided to go on a day hike in Great Bear Wilderness with her dog Mogi, prompting an extensive search when she didn't return."
"Gaetano Lo Presti, the ``godfather'' of the Palermo district of Porta Nuova, was found dead late last night in Pagliarelli prison in the Sicilian capital of Palermo.",An alleged mafia boss who was arrested in a massive sweep by Italian police hanged himself in a prison cell within hours of being detained.,"Gaetano Lo Presti, the ``godfather'' of the Palermo district of Porta Nuova who was arrested in a massive sweep by Italian police, was found dead late last night in Pagliarelli prison in the Sicilian capital of Palermo within hours of being detained."
