sentence1Text,sentence2Text,mergedText
"In August, China issued a circular requiring all officials who had invested in coal mines to retract stakes.","836 officials and state-owned enterprise (SOE) leaders have abandoned their coal mine investments in north China's Shanxi province, a major coal producing region, amid a nationwide crackdown on illegal coal mine investment by officials.","After China issued a circular in August requiring all officials who had invested in coal mines to retract stakes as part of a nationwide crackdown on illegal coal mine investment, 836 officials and state-owned enterprise (SOE) leaders have abandoned their coal mine investments in north China's Shanxi province, a major coal producing region."
"The Wachowskis and Tom Tykwer may have bitten off more than they-or anyone-could chew in attempting to make a film out of David Mitchell's enormous, past-and-future spanning novel Cloud Atlas.","The latest case in point is ""Cloud Atlas,"" which has been turned into a film with muddled, frustrating results.","In the latest case in point, the Wachowskis and Tom Tykwer may have bitten off more than they-or anyone-could chew in attempting to make a film out of David Mitchell's enormous, past-and-future spanning novel Cloud Atlas, which they did with muddled, frustrating results."
"While that may seem fairly ordinary for a comedian, in this case it was the first time in 28 years that Murphy has done a comedy bit on stage, explains the Washington Post.","[Eddie Murphy returns to standup, briefly, at Twain Prize ceremony]","While that may seem fairly ordinary for a comedian, in this case it was the first time in 28 years that Eddie Murphy has done a comedy bit on stage, explains the Washington Post, which he did briefly at the Twain Prize ceremony."
"""Otto is not in great shape right now ... [he] has been terrorized and brutalized for 18 months by a pariah regime in North Korea.""","The family of Otto Warmbier said Wednesday they are ""adjusting to a different reality"" following their son's return from North Korea, where he was ""brutalized"" by his captors and held for more than a year in a coma -- the cause of which is still unknown.","The family of Otto Warmbier said Wednesday they are ""adjusting to a different reality"" following their son's return from North Korea, where he is ""not in great shape"" after being ""terrorized and brutalized"" by his captors and held for more than a year in a coma -- the cause of which is still unknown."
Lindsay Lohan's attorney said Thursday the actress checked into a Southern California rehab facility that a state official said is unlicensed to perform the type of treatment a judge required her to receive.,"Lindsay Lohan's lawyer says the actress checked into rehab on Thursday, but the facility has not been officially sanctioned by the court that ordered her to serve 90 days of treatment.","Lindsay Lohan's lawyer says the actress checked into rehab on Thursday, but a state official said the Southern California facility has not been officially sanctioned by the court that ordered her to serve 90 days of treatment."
The cable system that was cut is known as SMW4 cable or South East Asia-Middle East-Western Europe 4.,"Internet and telephone communications between Europe, the Middle East and Asia were severely disrupted Friday after three undersea cables were damaged in the Mediterranean, France Telecom said.","Internet and telephone communications between Europe, the Middle East and Asia were severely disrupted Friday after three undersea cables that were part of the cable system known as SMW4 (South East Asia-Middle East-Western Europe 4) were damaged in the Mediterranean, France Telecom said."
"Matthew Hale, the white supremacist convicted last year of plotting to kill a federal judge, sent a statement through his mother on Thursday condemning the murder of the judge's husband and mother as a ""heinous crime"" that he had nothing to do with.","Held in virtual isolation in a federal detention facility while awaiting sentencing for a 2004 federal conviction for trying to arrange the murder of U.S. District Court Judge Joan Humphrey Lefkow, Hale told his mother in a brief telephone call Thursday that none of his followers played any part in Monday's murders of Lefkow's relatives.","Held in virtual isolation in a federal detention facility while awaiting sentencing for a 2004 federal conviction for trying to arrange the murder of U.S. District Court Judge Joan Humphrey Lefkow, white supremacist Matthew Hale told his mother in a brief telephone call Thursday that none of his followers played any part in Monday's murders of Lefkow's husband and mother, calling it a ""heinous crime"" that he had nothing to do with."
"Muslim immigration: ""I have no belief and do not support the idea that Muslims as a religious group should be denied admission to the United States.""",Sessions does not support a ban on Muslims entering the country,"Sessions on Muslim immigration: ""I have no belief and do not support the idea that Muslims as a religious group should be denied admission to the United States."""
U.S. officials said Thursday Washington was certain that Syrian military intelligence operatives remain in Lebanon in defiance of international demands to withdraw all forces and agents.,"The United States and the Lebanese opposition leader Walid Jumblatt have alleged that Syria is continuing to maintain intelligence agents in Lebanon, despite its withdrawal of troops from Lebanon in April.","The United States and the Lebanese opposition leader Walid Jumblatt have alleged on Thursday that Syria is continuing to maintain intelligence agents in Lebanon, despite its withdrawal of troops from Lebanon in April after international demands to do so."
"A 60-year-old woman charged with killing two young women in a Staunton ice cream shop 41 years ago was released without bail, authorities said Friday, because she is dying from kidney and heart disease and living in a hospice facility.","A co-worker has been charged in the 1967 slayings of two women at an ice cream shop in Staunton, but authorities say the suspect is near death with a terminal illness.","A 60-year-old woman charged with killing two young women she worked with in a Staunton ice cream shop 41 years ago was released without bail, authorities said Friday, because she is dying from kidney and heart disease and living in a hospice facility."
"If Dems ""want to insult the women of America by making them believe that they are helpless without Uncle Sugar coming in and providing for them a prescription each month for birth control because they cannot control their libido or their reproductive system without the help of the government, then so be it,"" the former Arkansas governor and potential 2016 hopeful told a Republican National Committee meeting.","And if the Democrats want to insult the women of America by making them believe that they are helpless without Uncle Sugar coming in and providing them a prescription each month for birth control because they cannot control their libido or their reproductive system without the help of the government, then so be it, let's that that discussion all across America, because women are far more than Democrats have made them to be.","And if the Democrats ""want to insult the women of America by making them believe that they are helpless without Uncle Sugar coming in and providing for them a prescription each month for birth control because they cannot control their libido or their reproductive system without the help of the government, then so be it,"" let's that that discussion all across America, because women are far more than Democrats have made them to be, the former Arkansas governor and potential 2016 hopeful told a Republican National Committee meeting."
A grandmother today told how she was lucky to be alive after being rescued from the tenth floor of Grenfell Tower by brave neighbours who carried her down smoke-logged stairs.,A resident of the tower named Michael described the moment he carried a small girl to safety from the burning tower.,"A grandmother today told how she was lucky to be alive after being rescued from the tenth floor of Grenfell Tower by brave neighbours who carried her down smoke-logged stairs, while another resident named Michael described the moment he carried a small girl to safety from the burning building."
"In opening statements Tuesday, public defender Peter Lynch said then-15-year-old Timmons was at the scene of the shooting and had a gun, but isn't the one who fired the fatal shot.","Emotional testimony and at times lies are what jurors heard Tuesday in the trial of Jermayne Timmons, the teen accused of shooting and killing 10-year-old Kathina Thomas last May in Albany.","Emotional testimony and at times lies are what jurors heard Tuesday in the opening statements of the trial of Jermayne Timmons, the then 15-year-old teen accused of shooting and killing 10-year-old Kathina Thomas last May in Albany; public defender Peter Lynch said Timmons wasn't the one who fired the fatal shot."
The observed H 2 must have been produced on Enceladus.,"found that the plume contains molecular hydrogen, H 2 , a sign that the water in Enceladus' ocean is reacting with rocks through hydrothermal processes (see the Perspective by Seewald).","The plume contains molecular hydrogen, H 2 , a sign that the water in Enceladus' ocean is reacting with rocks through hydrothermal processes (see the Perspective by Seewald)."
Rowling's first three Potter books have spawned three blockbuster spin-off films and a huge array of merchandise.,"One month before the release of the sixth volume in J.K. Rowling's hugely successful Harry Potter series, online retailer Amazon.com said Wednesday that advance orders had topped the half-million mark.","One month before the release of the sixth volume in J.K. Rowling's hugely successful Harry Potter series, the first three of which spawned three blockbuster spin-off films and a huge array of merchandise, online retailer Amazon.com said Wednesday that advance orders had topped the half-million mark."
"""We will never forget the blood of our emir Baitullah Mehsoud, We will always demand revenge for him inside America and outside,"" he said, addressing the ""enemies of God"" and Jordanian intelligence.","Al Jazeera quotes the former Jordanian doctor as saying it was the obligation of all of Mehsud's fighters ""to retaliate for his death in the United States and outside the United States.""","Al Jazeera quotes the former Jordanian doctor as saying it was the obligation of all of Mehsud's fighters to ""never forget the blood of our emir Baitullah Mehsoud"" and ""to retaliate for his death in the United States and outside the United States,"" addressing the ""enemies of God"" and Jordanian intelligence."
"Tara Reid has entered a rehab program, the American Pie star's rep confirmed to People and Us Weekly on Friday.","It's been a long time coming, but Tara Reid has finally entered Malibu Promises Treatment Center on Tuesday, her rep told People.com.","It's been a long time coming, but Tara Reid has finally entered Malibu Promises Treatment Center on Tuesday, the American Pie star's rep told People.com and Us Weekly on Friday."
"A 5.6 magnitude earthquake hit an island off Iran's southern coast on Sunday, injuring five people and damaging buildings, Iranian media said.","The tremor struck an area around the town of Dargahan on Qeshm island, at the entrance to the Persian Gulf, injuring five people and damaging buildings.","A 5.6 magnitude earthquake hit an area around the town of Dargahan on Qeshm, an island off Iran's southern coast at the entrance to the Persian Gulf on Sunday, injuring five people and damaging buildings, Iranian media said."
"""It's a shame that a bill like this one I'm signing today is even required, but I'm glad that we're standing up for religious freedom in this state,"" said Perry, who signed the bill to cheers and bell-ringing from a local group called the Lone Star Santas (""A group for men and women who live in Texas, and portray Santa Claus, Mrs. Claus, Elves and helpers,"" according to its website.","The only rule for this group is to talk and act the way Santa, Mrs. Claus, Elves and helpers would.","""It's a shame that a bill like this one I'm signing today is even required, but I'm glad that we're standing up for religious freedom in this state,"" said Perry, who signed the bill to cheers and bell-ringing from a local group called the Lone Star Santas (""A group for men and women who live in Texas, and portray Santa Claus, Mrs. Claus, Elves and helpers,"" according to its website, where the only rule for this group is to talk and act the way Santa, et al, would)."
"The Indianapolis Colts clinched a playoff spot and the five seed in the AFC playoffs with a 20-13 win over the Kansas City Chiefs on another Andrew Luck game-winning drive, his seventh of the season.","Andrew Luck threw for 205 yards to break the single-season rookie record, and his touchdown pass to Reggie Wayne late in the fourth quarter Sunday gave the Indianapolis Colts a 20-13 win over the Kansas City Chiefs and a berth in the playoffs.","Andrew Luck threw for 205 yards to break the single-season rookie record, and his touchdown pass to Reggie Wayne, his seventh of the season, late in the fourth quarter Sunday gave the Indianapolis Colts a 20-13 win over the Kansas City Chiefs and a berth and the five seed in the AFC playoffs."
"Cooper, the war crimes court spokeswoman, said Monday that Taylor ""remains in contact with his political network in Liberia on a day-to-day basis,"" adding that he'll ""remain a menace to West Africa until he is turned over for trial to the special court for Sierra Leone.""","Taylor, the former president of Liberia, is charged with warcrimes and crimes against humanity by the Special Tribunal for Sierra Leone for his role in that neighboring country's 1991-2001 civil war.","The former president is charged with warcrimes and crimes against humanity by the Special Tribunal for Sierra Leone for his role in that neighboring country's 1991-2001 civil war, yet Cooper, the war crimes court spokeswoman, said Monday that Taylor ""remains in contact with his political network in Liberia on a day-to-day basis,"" adding that he'll ""remain a menace to West Africa until he is turned over for trial to the special court for Sierra Leone."""
A 2010 study in the American Journal of Psychiatry linked suicide with increases in particulate matter in the air in Korea; 2011 research in the Journal of Affective Disorders made the same link in Taiwan.,"Bakian examined the records of more than 1,500 people who died by suicide in Salt Lake County between Jan. 1, 2000, and Dec. 31, 2010, and found that the odds of completing suicide were 20 percent higher for people exposed to increased levels of nitrogen dioxide in the two to three days before their deaths.","Bakian examined the records of more than 1,500 people who died by suicide in Salt Lake County between Jan. 1, 2000, and Dec. 31, 2010, and found that the odds of completing suicide were 20 percent higher for people exposed to increased levels of nitrogen dioxide in the two to three days before their deaths, while a 2010 study in the American Journal of Psychiatry also linked suicide with increases in particulate matter in the air in Korea, and 2011 research in the Journal of Affective Disorders made the same link in Taiwan."
"Armed robbers-some disguised as women-snatched $108 million worth of diamond rings, necklaces and luxury watches from a Harry Winston boutique on a posh Paris avenue in one of the largest jewel heists in history, officials said Friday.","A savvy band of jewel thieves, armed with guns and some posing as women, have struck in the heart of the city's golden triangle of luxury shops, stealing more than e85 million worth of diamonds, rings and watches from a posh Harry Winston boutique.","A savvy band of jewel thieves , armed with guns and some posing as women , have struck in the heart of Paris's golden triangle of luxury shops , stealing  $108 million worth of diamonds , rings, necklaces and luxury watches from a posh Harry Winston boutique in one of the largest jewel heists in history , officials said Friday."
These are just a few of the comments-some of them from an ex-prime minister's wife-being lobbed at a Canadian television host after he posted pictures online of himself with the cougar he'd hunted and killed.,A Canadian television personality is getting pilloried on social media after posting a photo of himself next to a cougar that he had killed.,A Canadian television personality is getting pilloried on social media with comments-some of them from an ex-prime minister's wife-being lobbed at after posting a photo of himself next to a cougar that he had killed.
A new energy bill now provides a mechanism for creating mandatory reliability rules.,An August 2005 federal law will create a process for mandating reliability rules.,An August 2005 federal energy law will create a process for mandating reliability rules.
"Straw also praised a Turkish court's decision Monday to drop charges of ""insulting Turkishness"" against international acclaimed novelist Orhan Pamuk, but said the country still needs to boost human rights as it works toward hoped-for membership in the European Union.","An Istanbul court dropped charges against the novelist Orhan Pamuk on Monday, ending a trial that put Turkey at odds with the European Union over the issue of freedom of speech.","Straw also praised a Turkish court's decision Monday to drop charges of ""insulting Turkishness"" against international acclaimed novelist Orhan Pamuk, but said the country still needs to boost human rights as it works toward hoped-for membership in the European Union, because the trial that put Turkey at odds with the EU over the issue of freedom of speech"
"Police long believed BTK graduated from Wichita State University, as Rader had.","Police had long believed BTK was a graduate of Wichita State University, as Rader was.","Police long believed BTK graduated from Wichita State University, as Rader had."
"A 22-year-old army veteran, recently returned from Afghanistan, was shot and killed early this morning after a dispute erupted outside a party celebrating his homecoming.","As Garcia stood on the sidewalk, a Hispanic man exited a dark SUV, smashed a beer bottle on the ground and yelled at the veteran from across the street, the news release stated.","Garcia, a 22-year-old army veteran recently returned from Afghanistan, was shot and killed early this morning after a dispute erupted outside a party celebrating his homecoming; the news release stated a Hispanic man exited a dark SUV, smashed a beer bottle on the ground and yelled at the veteran from across the street."
"Environmental awareness is rising in China, following the chemical plant explosion on the Songhua River.",The Songhua disaster was seen as a catalyst for change.,"Environmental awareness is rising in China, following the chemical plant explosion on the Songhua River."
"The Interior Department yesterday finalized rules changing the way it administers the Endangered Species Act, enabling other government agencies to decide on their own whether a project would harm an imperiled species without an independent scientific review.",The Bush administration on Thursday eliminated 35-year-old regulations in the Endangered Species Act that required an independent scientific review of proposed federal projects to determine whether they imperil protected plants and animals.,"The Bush Administration's Interior Department yesterday finalized rules changing the way it administers the Endangered Species Act, enabling other government agencies to decide on their own whether a proposed federal project would harm an imperiled plant or animal species without the independent scientific review required under 35-year-old regulations."
Obama White House reverses Bush rule on protection of endangered species,Obama Administration Flips Bush Endangered Species Ruling,Obama White House reverses Bush rule on protection of endangered species
"KU's conclusion made several recommendations for Quenette going forward, she said: Undergo cultural competency training, reevaluate orientation curriculum to include more diversity support and pair up with a faculty mentor.","The university recommended that Quenette undergo cultural competency training, re-evaluate orientation curriculum to include more diversity support and pair up with a faculty member.","KU University's conclusion made several recommendations for Quenette going forward, she said: Undergo cultural competency training, reevaluate orientation curriculum to include more diversity support and pair up with a faculty mentor."
The 10-year-old was shot on the night of May 29th while she was playing outside her First Street home.,"Last May, a stray bullet killed 10-year-old Kathina Thomas as she played on the front steps of her home on Albany's First Street",On the night of May 29th a stray bullet killed 10-year-old Kathina Thomas as she played on the front steps of her home on Albany 's First Street
"The politicians are among 59 people held hostage by the FARC, including 22 politicians, 34 military personnel and police officers and three US nationals.",The trio remain in captivity despite a five-million-dollar US reward for information leading to their release and an August offer from Colombian President Alvaro Uribe to swap 50 imprisoned rebels for their freedom along with that of 22 politicians and 34 soldiers and police officers held by the FARC.,"The trio remain in captivity despite a five-million-dollar US reward for information leading to their release and an August offer from Colombian President Alvaro Uribe to swap 50 imprisoned rebels for their freedom along with that of 59 people including 22 politicians, three US nationals and 34 soldiers and police officers held by the FARC."
"That afternoon, prosecutors dropped Marion county charges and the penalties against Lafave remained those in the Hillsborough agreement.","Therefore, LaFave will live under the plea deal reached in Hillsborough County of three years house arrest and seven years probation.","That afternoon, prosecutors dropped Marion county charges and the penalties against Lafave remained those in the Hillsborough county plea deal, in which LaFave will live under three years house arrest and seven years probation."
"The 33-year-old hard partying actress finally decided to put an end to her drinking days and get help for her addictions, although her publicist refused to disclose the real reason why Reid checked into rehab.","After telling People in October that she didn't ``need to do any of that anymore,'' ``American Pie'' actress and former travel reporter Tara Reid checked into Promises Treatment Center on Friday for an unspecified problem.","The 33-year-old hard partying ``American Pie'' actress and former travel reporter Tara Reid finally decided to put an end to her drinking days and get help for her addictions, telling People in October that she didn't ``need to do any of that anymore,'', although her publicist refused to disclose the real reason why Reid checked into rehab at Promises Treatment Center on Friday."
"The headline encapsulates the two-fold nature of the piece: recounting the ""most definitive account"" (verified by a number of sources, including other SEALS) ""of those crucial few seconds"" in which the Shooter put three bullets into bin Laden's head; and tackling this incongruity: ""that a man with hundreds of successful war missions, one of the most decorated combat veterans of our age, who capped his [16-year] career by terminating bin Laden, has no landing pad in civilian life.""","But a series of confidential conversations, detailed descriptions of mission debriefs, and other evidence make it clear: The Shooter's is the most definitive account of those crucial few seconds, and his account, corroborated by multiple sources, establishes him as the last man to see Osama bin Laden alive.","The headline encapsulates the two-fold nature of the piece: recounting the ""most definitive account"" of those crucial few seconds where The Shooter was the last man to see Osama bi Laden alive (verified by a number of sources, including a series of confidential conversations, detailed descriptions of mission debriefs, and other evidence from SEALS) ""of those crucial few seconds"" in which the Shooter put three bullets into bin Laden's head; and tackling this incongruity: ""that a man with hundreds of successful war missions, one of the most decorated combat veterans of our age, who capped his [16-year] career by terminating bin Laden, has no landing pad in civilian life."""
"On May 23, 2005 sports newspaper L'Equip reported Armstrong illegally used erythropoietin for the 1999 Tour de France, based on urine samples examined outside World Anti-Doping Agency protocols, but linked to Armstrong by L'Equip, in violation of WADA anonymity rules.",The newspaper reported that a laboratory outside Paris had tested the frozen Tour de France urine samples and that documents link six of the positive tests to Armstrong.,"On May 23, 2005 sports newspaper L'Equip reported Armstrong illegally used erythropoietin for the 1999 Tour de France, based on frozen urine samples examined by a laboratory outside Paris outside World Anti-Doping Agency protocols, but linked to Armstrong by L'Equip using documents linking six of the positive tests to him, in violation of WADA anonymity rules."
