sentence1Text,sentence2Text,mergedText
The tsunami uprooted mangrove forests from Sri Lanka to Thailand and damaged their ecosystems.,"A U.N. agriculture agency pushed for early rehabilitation of mangroves damaged by the tsunami, but warned against overforestation  to the detriment of other ecosystems.","A U.N. agriculture agency pushed for early rehabilitation of mangroves from Sri Lanka to Thailand that were damaged by the tsunami, but warned against overforestation to the detriment of other ecosystems."
"Australia strongly opposes Japan's plan to increase its authorized kill of whales in Antarctic waters at the annual meeting of the International Whaling Commission opening May 30, 2005 in South Korea.  ","Japan plans to seek permission to expand its so-called research whaling program when the International Whaling Commission (IWC) meets in late May, intending to nearly double its annual catch of minke whales and to hunt endangered humpback and fin whales.  ","Japan plans to seek permission to expand its so-called research whaling program at the annual International Whaling Commission (IWC) meeting that opens May 30, 2005 in South Korea, intending to nearly double its authorized annual catch of minke whales and to hunt endangered humpback and fin whales in Antarctic waters, while Australia strongly opposes the plan."
Christians make up about three percent of Iraq's population.,"Religious minorities in Iraq, especially Christians, account for 3 percent of the population of 25 million, most of them Shiites and Sunnis.","Religious minorities in Iraq, especially Christians, account for 3 percent of the population of 25 million, most of them Shiites and Sunnis."
"""People [in Flint] were paying the highest rates in the country for water that was toxic,"" said Mary Grant, a lead author on the report.","But the water in the city cost ""far above the threshold for what the United Nations considers affordable,"" according to Grant.","""People [in Flint] were paying the highest rates in the country, far above the threshold for what the United Nations considers affordable, for water that was toxic,"" said Mary Grant, a lead author on the report."
"Six days after a 2003 removal it was reinserted after Governor Jeb Bush pushed ""Terri's law"" through the Florida Legislature.","In October 2003, Florida Governor Jeb Bush invoked a law rushed through the state legislature to overrule a court ruling authorizing the removal of the life support for Schiavo.","In October 2003, six days after a removal it was reinserted, after Florida Governor Jeb Bush invoked ""Terri's law"" rushed through the state legislature to overrule a court ruling authorizing the removal of the life support for Schiavo."
"Bristol County District Attorney Thomas M. Quinn III said late Tuesday that Arthur DaRosa, 28, of Taunton, crashed a car outside a home in the city, walked inside and stabbed an 80-year-old woman and another woman.",An off-duty officer shot and killed a man who allegedly stabbed two people to death during a rampage at two locations in Taunton Tuesday night.,"Bristol County District Attorney Thomas M. Quinn III said late Tuesday that Arthur DaRosa, 28, of Taunton, crashed a car outside a home in the city, walked inside and stabbed an 80-year-old woman and another woman, before being shot and killed by an off-duty officer."
"Other studies are looking into the effects and effectiveness of oral contraceptives, an underactive thyroid, olive oil, a cell's ability to repair DNA, and the flushing of milk ducts.","The milk duct technique, called ductal lavage, is among those experimental alternatives.","Other studies are looking into the effects and effectiveness of experimental alternatives like oral contraceptives, an underactive thyroid, olive oil, a cell's ability to repair DNA, and the flushing of milk ducts, called ductal lavage."
"""There is the potential for induced currents in power grids,"" he continues.","""There is the potential for induced currents in power grids,"" Kunches told reporters Wednesday.","""There is the potential for induced currents in power grids,"" Kunches told reporters Wednesday."
"The submarine, used in rescue, research and intelligence-gathering missions, became stuck at the bottom of the Bay of Berezovaya off Russia's Far East coast when its propeller was caught in a fishing net on Thursday.","Although the initial reports indicated that the submarine was tangled in a fishing net, late Friday here the Russian navy said it might have become stuck against an undersea piece of military equipment that it was inspecting.","Although the initial reports indicated that the submarine's propeller was tangled in a fishing net on Thursday, late Friday here the Russian navy said the submarine, used in rescue, research and intelligence-gathering missions, might have become stuck against an undersea piece of military equipment that it was inspecting at the bottom of the Bay of Berezovaya, off Russia's Far East coast."
"After Profounda got the call, notes the Sentinel, ""the drug to treat Sebastian was delivered in 12 minutes.""","After the company got the call from the hospital, the drug to treat Sebastian was delivered in 12 minutes.","After Profounda got the call from the hospital, notes the Sentinel, ""the drug to treat Sebastian was delivered in 12 minutes."""
"Newborns who sleep on animal fur in the first months of life aren't as likely to come down with asthma and allergies later in life, a new study suggests.",Scientists have found that sleeping on animal fur in the first three months of life may reduce the risk of asthma in later childhood.,Scientists have found that sleeping on animal fur in the first three months of life may reduce the risk of asthma and allergies in later childhood.
"An earthquake measuring 5.6 on the Richter scale jolted Qeshm island off Iran's southern coast on Sunday, followed by several aftershocks on Monday.","An earthquake with a magnitude of 5.6 on the Richter scale shook the southern Iranian island of Qeshm and caused damage to residential buildings in villages on Sunday, ISNA news agency reported.","An earthquake with a magnitude of 5.6 on the Richter scale shook the southern Iranian island of Qeshm and caused damage to residential buildings in villages on Sunday, ISNA news agency reported, followed by several aftershocks on Monday."
"Four men rammed their car into an upmarket jewellery store in central Paris on Monday, smashing the shop window and making off with a two-million-euro ($2.6-million) booty, a police source said.","Four men rammed their car into an up-market jewellery store in central Paris today, smashing the shop window and making off with a €2 million (R26 million) booty, a police source said.","Four men rammed their car into an up-market jewellery store in central Paris today, smashing the shop window and making off with a €2 million (R26 million) booty, a police source said."
"As a Southwest Airlines jet hurtled 32,000 feet over suburban Philadelphia, a rare engine explosion caused a passenger's window to burst, partially pulling the woman sitting next to the opening out of the plane.",Passengers described hearing a loud explosion from the left engine - one of two onboard - before debris peppered the fuselage and shattered that window.,"As a Southwest Airlines jet hurtled 32,000 feet over suburban Philadelphia, passengers described hearing a rare loud explosion from the left engine - one of two onboard - before debris peppered the fuselage and shattered a passenger's window, partially pulling the woman sitting next to the opening out of the plane."
"A PROVISIONAL trial date has been set in the case of a son accused of killing his mother, sister and pet dog in Millom.",A trial date's been set for a Millom man accused of murdering his mother and sister.,"A PROVISIONAL trial date has been set in the case of a son accused of killing his mother, sister and pet dog in Millom."
"A Woodburn police officer and state police bomb squad technician were killed, while the city's police chief remained in critical condition after a bomb exploded late Friday at a Woodburn bank.","A bomb exploded Friday at a West Coast Bank branch in Woodburn, killing a Woodburn police officer and an Oregon State Police bomb squad technician, and critically injuring the Woodburn police chief.","A bomb exploded Friday at a West Coast Bank branch in Woodburn, killing a Woodburn police officer and an Oregon State Police bomb squad technician, and critically injuring the Woodburn police chief."
President Bush's nomination of Harriet Miers for the Supreme Court caused much consternation.,"US President George W. Bush has picked White House legal counsel Harriet Miers to be a new US Supreme Court justice, an administration official told AFP early Monday.","US President George W. Bush has picked White House legal counsel Harriet Miers to be a new US Supreme Court justice, an administration official told AFP early Monday, causing much consternation."
A survey of cell phone records and accidents in Australia conducted by the U.S. based Insurance Institute for Highway Safety concludes that there is little difference between hand-held and hands-free device driver distraction.,"Tyson said research from within and outside the agency, along with driving simulations, had found that it was the talking on a cell phone while driving that was distracting, and that therefore cell phones should only be used in emergencies.","Tyson said research from within and outside the U.S. based Insurance Institute for Highway Safety agency, along with driving simulations, had found that it was the talking on a cell phone while driving that was distracting, and that therefore cell phones should only be used in emergencies, the agency’s survey of cell phone records and accidents in Australia concludes that there is little difference between hand-held and hands-free device driver distraction."
"On Twitter, London defended himself, claiming he was ""jumped"" after ""some guy thought I was hitting on his girl.""","""He continues, ""Some guy thought I was hitting on his girl and had me jumped.","On Twitter, London defended himself, claiming he was ""jumped"" after ""some guy thought I was hitting on his girl."""
"In 2016, a different line of Golden Goose sneakers featuring tape and scuff marks drew some criticism.","The company was involved in this same type of controversy in 2016, when it sold similarly stressed shoes for similarly outrageous prices.","The company was involved in this same type of controversy in 2016, when it sold similarly stressed shoes, Golden Goose sneakers featuring tape and scuff marks, for similarly outrageous prices."
Farming losses are expected to be $900 million.,Agricultural losses were estimated at $900 million.,Agricultural losses were estimated at $900 million.
"The New Orleans Saints have placed running back Pierre Thomas on the injured reserve list a day after their leading rusher, Chris Ivory, was shut down for the season.","Pierre Thomas, the Saints' leading rusher in 2009, was put on injured reserve, the team announced Wednesday.","On Wednesday, the New Orleans Saints announced that they placed running back Pierre Thomas, their leading rusher in 2009, on the injured reserve list a day after their leading rusher, Chris Ivory, was shut down for the season."
"President Obama says he will ""probably"" stay in Washington for a few years after his term ends so that his youngest daughter can finish high school.","Saying it wouldn't be fair to disrupt their lives after seven years in the same school district, Barack and Michelle Obama this week announced their plans to stay in the White House until their daughters graduate high school.","Saying it wouldn't be fair to disrupt their lives after seven years in the same school district, Barack and Michelle Obama this week announced their plans to stay in the White House until their youngest daughter graduates high school."
"On June 8, Janice Rogers Brown won confirmation.","On June 8, 10 Democrats joined Republicans to close debate and the Senate voted 56-43 to confirm Brown.","On June 8, 10 Democrats joined Republicans to close debate and the Senate voted 56-43 to confirm Janice Rogers Brown."
"Fines have been established for wrongful deaths, and rewards offered to whistleblowers.",In Hunan Province cash awards are offered to those who report officials who illegally own shares in mines.,"In Hunan Province cash awards are offered to those who report officials who illegally own shares in mines, and fines have been established for wrongful deaths."
"There are only about 2,000 left in the wild, and scientists are afraid one cataclysmic disease could wipe them out.","There are thought to be only 2,000 individuals left in the wild, making them extremely vulnerable to natural disasters or disease, of which a single severe incident could wipe out the whole species.","There are thought to be only 2,000 individuals left in the wild, making them extremely vulnerable to natural disasters or disease, of which scientists are afraid a single severe incident could wipe out the whole species."
"The ISRO announced the payloads from the US, Bulgaria, Germany and Britain for the Chandrayaan-1 mission.",India's first unmanned moon mission planned for 2007-08 will carry three European payloads for conducting various experiments relating to the lunar surface.,"The ISRO announced that India's first unmanned moon mission planned for 2007-08 will carry three European payloads from the US, Bulgaria, Germany and Britain for conducting various experiments relating to the lunar surface."
"In February 2005 North Korea declared it manufactured nuclear weapons and won't rejoin six-nation talks (North Korea, South Korea, China, Russia, Japan, U.S.).","Since 2003, the six-nation (United States, North Korea, South Korea, China, Japan and Russia) talks have aimed at persuading North Korea to abandon its nuclear weapons in exchange for diplomatic and economic benefits and security guarantees.","Since 2003, the six-nation (United States, North Korea, South Korea, China, Japan and Russia) talks have aimed at persuading North Korea to abandon its nuclear weapons in exchange for diplomatic and economic benefits and security guarantees, but in February 2005 North Korea declared it manufactured nuclear weapons and won't rejoin the talks."
The killer broke into U.S. District Judge Joan H. Lefkow's house and hid in a utility closet.,The killer broke into U.S. District Judge Joan Lefkow's home and hid in a utility closet.,The killer broke into U.S. District Judge Joan H. Lefkow's house and hid in a utility closet.
"The District of Columbia, NY state, New Jersey, Connecticut and Chicago ban the use of hand-held cell phones while driving.","Since New York passed the nation's first statewide law banning hand-held cell phones while driving four years ago, New Jersey and Washington, D.C., have followed with laws that went into effect last summer.","Since New York passed the nation's first statewide law banning hand-held cell phones while driving four years ago, New Jersey and Washington, D.C. (District of Columbia), Connecticut and Chicago have followed with laws that went into effect last summer."
"The investigation began with allegations of fraud in dealings with a number of American Indian tribes, but widened to include golf junkets and dealings in the Northern Marianas.","A group of congressional figures has joined House Majority Leader Tom DeLay, R-Texas, under an ethics cloud stemming from foreign golf junkets arranged by a lobbyist facing influence peddling investigations.","A group of congressional figures has joined House Majority Leader Tom DeLay, R-Texas, under an ethics cloud whose investigation began with allegations of fraud in dealings with a number of American Indian tribes but widened to dealings in the Northern Marianas and foreign golf junkets arranged by a lobbyist facing influence peddling investigations."
"A month-long clinical trial shows a once-daily male pill is safe and effective at suppressing the hormones needed for sperm production, and has no negative effect on sex drive, according to researchers who presented their findings Sunday at the Endocrine Society's annual conference in Chicago, per the Telegraph.","A male pill could be on the horizon after early trials showed a once-daily tablet was safe and appeared to work, according to researchers.","A male pill could be on the horizon after, a month-long clinical trial showed a once-daily tablet is safe and effective at suppressing the hormones needed for sperm production, and has no negative effect on sex drive, according to researchers who presented their findings Sunday at the Endocrine Society's annual conference in Chicago, per the Telegraph."
"Manning threw for 364 yards and three touchdowns, and the visiting Colts secured the No. 5 seed in the AFC playoffs with a 31-24 victory over the Jaguars on Thursday night.",Peyton Manning passed for 364 yards and three touchdowns and Keiwan Ratliff returned an interception 35-yards for a pick-six with just under five minutes left to carry the Indianapolis Colts over the Jacksonville Jaguars 31-24 Thursday night.,"Peyton Manning passed for 364 yards and three touchdowns and Keiwan Ratliff returned an interception 35-yards for a pick-six with just under five minutes left to carry the visiting Indianapolis Colts over the Jacksonville Jaguars 31-24 Thursday night, securing the No. 5 seed in the AFC playoffs."
The people of Turkmenistan have voted in the first parliamentary election held after the adoption of a new constitution earlier this year.,"The government of Turkmenistan said 90 per cent of eligible voters had participated in parliamentary elections Sunday, despite boycotts from opposition groups.","The government of Turkmenistan said 90 percent of eligible voters had participated in parliamentary elections Sunday, the first held after the adoption of a new constitution earlier this year, despite boycotts from opposition groups."
Insurgents abducted a Syrian Catholic Archbishop apparently to frighten Iraqi Christians in upcoming elections.,"""It could be an attack on Christians who are willing to participate in the elections,"" said Assyrian Democratic Movement spokesman William Warda.","""It could be an attack on Christians who are willing to participate in the elections,"" said Assyrian Democratic Movement spokesman William Warda, after insurgents abducted a Syrian Catholic Archbishop."
The fire that destroyed the original Matanuska Maid Dairy warehouse in Palmer on Tuesday took a piece of Alaska’s history.,"A fire on Tuesday destroyed Palmer's historic Matanuska Maid Dairy warehouse building, which was built in the 1930s when colonists arrived from the Midwest to try their hand at farming in Alaska.","A fire on Tuesday destroyed Palmer's original historic Matanuska Maid Dairy warehouse building and took a piece of Alaska’s history, it was built in the 1930s when colonists arrived from the Midwest to try their hand at farming in Alaska."
"For the Win reports he asked the crowd gathered there, ""How's Joe Paterno?","The Republican presidential nominee asked the crowd, ""How's Joe Paterno?","For the Win reports the Republican presidential nominee asked the crowd gathered there, ""How's Joe Paterno?"""
"Manning threw for 364 yards and three touchdowns, and the visiting Colts secured the No. 5 seed in the AFC playoffs with a 31-24 victory over the Jaguars on Thursday night.","Manning threw for 364 yards and three touchdowns, helping the Colts secure the No. 5 seed in the American Football Conference playoffs with a 31-24 victory over the Jaguars in Jacksonville, Fla.","Manning threw for 364 yards and three touchdowns on Thursday night, helping the visiting Colts secure the No. 5 seed in the American Football Conference playoffs with a 31-24 victory over the Jaguars in Jacksonville, Fla."
"The official condition of the Harrisburg officer isn't known, though Harrisburg Police Chief Tom Carter told KOMO both officers are ""doing OK."" ""No words can adequately express the sadness we feel at this moment as we contemplate the loss of yet another law enforcement officer in the line of duty,"" Papenfuse adds in a statement.","""No words can adequately express the sadness we feel at this moment as we contemplate the loss of yet another law enforcement officer in the line of duty,"" Mayor Eric Papenfuse said in a statement.","The official condition of the Harrisburg officer isn't known, though Harrisburg Police Chief Tom Carter told KOMO both officers are ""doing OK."" ""No words can adequately express the sadness we feel at this moment as we contemplate the loss of yet another law enforcement officer in the line of duty,"" Mayor Eric Papenfuse adds in a statement."
"Doctors say the benign tumor, which started growing about 12 years ago, probably began as an ingrown hair.","The tumor, likely caused by an ingrown hair, was attached to Logan's abdomen.","Doctors say the benign tumor, which was attached to Logan's abdomen, started growing about 12 years ago, probably began as an ingrown hair."
Authorities say a 35-year-old New Bedford man stabbed his ex-girlfriend and his own mother to death during a bloodbath inside his mom's apartment and left the bodies to rot for days.,"Both women had been stabbed to death and their bodies had been there for ``days,'' Miliote said.",Authorities say a 35-year-old New Bedford man stabbed his ex-girlfriend and his own mother to death during a bloodbath inside his mom's apartment and left the bodies to rot for days.
Munich shooting: teenage gunman researched killing sprees but had no Isis links Read more,"Police officers secure evidence from a flat in Dachauer Strasse after a shooting the day before leaving nine people dead on Saturday, July 23, 2016 in Munich, Germany.","Police officers secure evidence from a flat in Dachauer Strasse after a shooting the day before, by a teenage gunman who researched killing sprees but had no Isis links, left nine people dead on Saturday, July 23, 2016 in Munich, Germany."
"This frightening surveillance video was presented at the Brooklyn Supreme Court on Thursday during the trial of two men accused in killing Zurana Horton, 34, a mother of 12, in 2011 and wounding two others, including an 11-year-old girl.",Prosecutors have released new video in the trial of two men accused of killing a Brownsville mother of 12 in Oct. 2011.,"Prosecutors released this frightening new surveillance video was presented at the Brooklyn Supreme Court on Thursday during the trial of two men accused in killing Zurana Horton, 34, a Brownsville mother of 12, in Oct. 2011 and wounding two others, including an 11-year-old girl."
"The U.N. Chief, supported by Egypt, Saudi Arabia, the U.S., France and Russia, called for full withdrawal.","UN chief Kofi Annan has called for a Syrian troop pullout from Lebanon before April, warning that the Security Council could otherwise take ""measures"" against Damascus, in an interview with Al-Arabiya television, the news channel said Thursday.","UN chief Kofi Annan, supported by Egypt, Saudi Arabia, the U.S., France and Russia, has called for a Syrian troop pullout from Lebanon before April, warning that the Security Council could otherwise take ""measures"" against Damascus, in an interview with Al-Arabiya television, the news channel said Thursday."
Authorities say a 35-year-old New Bedford man stabbed his ex-girlfriend and his own mother to death during a bloodbath inside his mom's apartment and left the bodies to rot for days.,A man with a long history of domestic violence has been accused of stabbing his mother and a former girlfriend to death and leaving their bodies in an apartment for several days.,Authorities say a 35-year-old New Bedford man stabbed his ex-girlfriend and his own mother to death during a bloodbath inside his mom's apartment and left the bodies to rot for days; the man had a long history of domestic violence.
"The Holloway family, without police assistance, identified and located the three men in custody less than 24 hours after Natallee went missing.  ","They, not police, identified and located Joran.  ","The Holloway family, without police assistance, identified and located the three men in custody, including Joran, less than 24 hours after Natallee went missing."
"The New Orleans Saints placed Reggie Bush on the injured list on Wednesday, ending the National Football League season for the star running back.","Payton said the Saints, who were eliminated from playoff contention over the weekend, would not have placed Bush on injured reserve if they were still fighting to reach the postseason.","Payton said the New Orleans Saints, who were eliminated from playoff contention over the weekend, would not have placed Reggie Bush on injured reserve on Wednesday, ending the National Football League season for the star running back, if they were still fighting to reach the postseason."
Soeharto has been summoned twice to the AGs office but declined due to health reasons.,"Soeharto did not appear, due to poor health.","Soeharto has been summoned twice to the AG's office but declined to appear, due to poor health."
The cable system that was cut is known as SMW4 cable or South East Asia-Middle East-Western Europe 4.,"The cut occurred on lines between 07:28 and 08:06 Coordinated Universal Time (UTC) on lines in the Mediterranean sea that connect Sicily to Tunisia and Egypt, the telecommunications company said.","The cut occurred on lines between 07:28 and 08:06 Coordinated Universal Time (UTC) on the cable system South East Asia-Middle East-Western Europe 4 (SMW4), in the Mediterranean sea that connects Sicily to Tunisia and Egypt, the telecommunications company said."
